,author,content,description,publishedAt,source,title,url,urlToImage,count
144,SA Editor Liz Kiesche,"HSBC (NYSE: HSBC ) says it's launching a digital lending platform for U.S. customers in H1 2019, almost 10 years since it wrote off $10.6B for its last venture into that market, according to the Financial Times. Online lender Avant will power the platform. ""T… [+290 chars]","HSBC (NYSE:HSBC) says it's launching a digital lending platform for U.S. customers in H1 2019, almost 10 years since it wrote off $10.6B for its last venture into that market, according to the Financi",2018-10-22 21:51:40,"{'id': None, 'name': 'Seekingalpha.com'}",HSBC re-enters consumer lending in the U.S.,https://seekingalpha.com/news/3399502-hsbc-re-enters-consumer-lending-u-s,https://static3.seekingalpha.com/assets/og_image_192-59bfd51c9fe6af025b2f9f96c807e46f8e2f06c5ae787b15bf1423e6c676d4db.png,1
145,Robin Saks Frankel,The HSBC Cash Rewards Mastercard® credit card has made its sign-up bonus much more difficult to snag. The minimum spending amount required is now five times as big as it was before. The card now offers the following: $150 Cash Back Intro Bonus for new HSBC Ca… [+2294 chars],The HSBC Cash Rewards Mastercard® credit card has made its sign-up bonus much more difficult to snag. The minimum spending amount required is now five times as big as it was before.…,2018-10-22 22:39:59,"{'id': None, 'name': 'Nerdwallet.com'}",HSBC Cash Rewards Card Hikes Requirement for Sign-up Bonus,https://www.nerdwallet.com/blog/credit-cards/hsbc-cash-rewards-card-hikes-requirement-for-sign-up-bonus/,https://www.nerdwallet.com/assets/blog/wp-content/uploads/2018/10/shopping.jpg,1
146,Sputnik,"The Future Investment Initiative, sometimes referred to as Davos in the Desert, usually brings high rollers from all over the globe and is hosted by none other than the kingdoms crown prince himself, Mohammad bin Salman. But since the killing of Saudi nationa… [+2251 chars]","The Future Investment Initiative, sometimes referred to as “Davos in the Desert,” usually brings high rollers from all over the globe and is hosted by none other than the kingdom’s crown prince himself, Mohammad bin Salman.",2018-10-22 23:42:07,"{'id': None, 'name': 'Sputniknews.com'}",Hackers Took Over Website for Saudi Investment Conference,https://sputniknews.com/us/201810231069120815-Hackers-Website-Saudi-Conference/,https://cdn3.img.sputniknews.com/images/106912/06/1069120649.png,1
147,Reuters Editorial,Oct 23 (Reuters) - The following are the top stories in the Financial Times. Reuters has not verified these stories and does not vouch for their accuracy. Headlines HSBC gets back into U.S. consumer lending on.ft.com/2EQCkMr Uber chief says workplace culture … [+748 chars],The following are the top stories in the Financial Times. Reuters has not verified these stories and does not vouch for their accuracy.,2018-10-23 00:30:27,"{'id': 'reuters', 'name': 'Reuters'}",PRESS DIGEST- Financial Times - Oct 23,https://www.reuters.com/article/britain-press-ft/press-digest-financial-times-oct-23-idUSL2N1X300N,https://s4.reutersmedia.net/resources_v2/images/rcom-default.png,1
148,Viola Gaskell,"Hong Kong - President Xi Jinping opened the long-delayed and over-budget Hong Kong-Zhuhai-Macau Bridge on Tuesday, billed as a major step forward in China's plan to turn the Pearl River Delta into a technology hub to rival Silicon Valley. But critics worry th… [+6006 chars]","Hong Kong-Zhuhai-Macau Bridge seen as crucial for China's 'Silicon Valley', but some worry about its political impact.",2018-10-23 02:09:44,"{'id': 'al-jazeera-english', 'name': 'Al Jazeera English'}",China's president opens long-delayed southern sea bridge,https://www.aljazeera.com/news/2018/10/china-president-opens-long-delayed-southern-sea-bridge-181022030517113.html,https://www.aljazeera.com/mritems/Images/2018/10/22/bde319f8a6dc4671a618b243a63f5ffa_18.jpg,1
151,Michael Bodley,"To sell more smartwatches, Samsung is eyeing the wrists of bank employees. The brand inked a deal with HSBC in September to customize 12 Samsung Gear S3 watches for HSBC bankers at the company’s Fifth Avenue branch in New York City. The custom watches were f … [+2975 chars]","As Samsung tries to rebound from slowing growth from smartphone sales, the Apple competitor is renewing its push into the business-to-business sector. The post HSBC tests smartwatches as a way to cut wait times appeared first on Digiday.",2018-10-23 04:00:56,"{'id': None, 'name': 'Digiday.com'}",HSBC tests smartwatches as a way to cut wait times,https://digiday.com/retail/hsbc-samsung-smartwatches-customer-service/,https://digiday.com/wp-content/uploads/2018/03/hsbc.png,1
153,info@tabnak.ir,Saudi Arabia's big investment conference starts Tuesday under the shadow of Jamal Khashoggi's death. Dozens of top business leaders from around the world have pulled out of the Future Investment Initiative as questions have mounted over the Saudi government's… [+3743 chars],Saudi Arabia's big investment conference starts Tuesday under the shadow of Jamal Khashoggi's death.,2018-10-23 05:51:06,"{'id': None, 'name': 'Tabnak.ir'}",Saudi investment conference begins after exodus of CEOs,https://www.tabnak.ir/fa/news/845278/saudi-investment-conference-begins-after-exodus-of-ceos,,1
154,,"Grey London has created an ad for HSBC UK's commercial banking division starring British comic Richard Ayoade. The bank’s ""Together we thrive"" campaign launched in January with the ""Global citizen"" spot and was followed by a second, ""Own the unknown"", in May.… [+1343 chars]",J Walter Thompson created the first two spots in the bank's 'Together we thrive' campaign.,2018-10-23 08:25:51,"{'id': None, 'name': 'Campaignlive.co.uk'}",HSBC's Richard Ayoade-fronted campaign is back with business rallying cry,https://www.campaignlive.co.uk/article/hsbcs-richard-ayoade-fronted-campaign-back-business-rallying-cry/1496932,https://cached.imagescaler.hbpl.co.uk/resize/scaleHeight/815/cached.offlinehbpl.hbpl.co.uk/news/OMC/HSBCbusiness-20181023092951768.jpg,1
155,Al Jazeera,"Saudi Arabia has brushed off an outcry over the killing of journalist Jamal Khashoggi and went ahead with an investment conference boycotted by Western political figures, leading international bankers and A-list executives. The three-day conference - a brainc… [+3179 chars]","Dubbed 'Davos in the desert,' the event has been overshadowed by Riyadh's admission to dissident journalist's killing.",2018-10-23 09:05:05,"{'id': 'al-jazeera-english', 'name': 'Al Jazeera English'}",Saudi investment forum opens under Khashoggi shadow,https://www.aljazeera.com/news/2018/10/saudi-investment-forum-opens-khashoggi-shadow-181023074104589.html,https://www.aljazeera.com/mritems/Images/2018/10/23/5862113fd1bf425b97d3ae117aaa11af_18.jpg,1
156,Editorial Team,"Voltron, a coalition of banks building a blockchain-based network for automating Letters of Credit and trade finance documentation, has thrown open its doors to other banks and corporates ahead of a planned roll out in 2019. Founding members of Voltron includ… [+3644 chars]","Voltron, a coalition of banks building a blockchain-based network for automating Letters of Credit and trade finance documentation, has thrown open its doors to other banks and corporates ahead of a planned roll out in 2019.",2018-10-23 09:41:29,"{'id': None, 'name': 'Finextra.com'}",Sibos: Blockchain to the fore with Voltron; Accenture makes DLT interoperability play,https://www.finextra.com/newsarticle/32837/sibos-blockchain-to-the-fore-with-voltron-accenture-makes-dlt-interoperability-play?utm_medium=rss&utm_source=finextrafeed,https://www.finextra.com/finextra-images/top_pics/xl/collaborate.jpg,1
157,Live from a Lounge,JetPrivilege frequently runs promotions where they offer bonus JPMiles when you convert other reward points to JPMiles. The bonus usually ranges anywhere from 20-50%. Now there is a new JPMiles conversion offer where you can get a flat 70% extra miles on conv… [+2472 chars],"JetPrivilege is offering a targeted 70% bonus on transferring other points to JPMiles from banks and hotel partners. The promotion is valid till October 31, 2018. This is one of the most generous conversion bonuses yet! The post Get 70% bonus JPMiles on conve…",2018-10-23 10:18:54,"{'id': None, 'name': 'Boardingarea.com'}",Get 70% bonus JPMiles on conversions!,https://livefromalounge.boardingarea.com/2018/10/23/jpmiles-conversion-offer-70/,https://livefromalounge.boardingarea.com/wp-content/uploads/2018/10/Screen-Shot-2018-10-23-at-1.26.33-PM.png,1
158,Andrew Torchia,"RIYADH (Reuters) - Saudi Arabia was set to sign deals worth $50 billion on Tuesday at the opening of an investment conference despite being overshadowed by the killing of journalist Jamal Khashoggi which prompted a boycott by Western politicians, top world ba… [+4560 chars]","Saudi Arabia was set to sign deals worth $50 billion on Tuesday at the opening of an investment conference despite being overshadowed by the killing of journalist Jamal Khashoggi which prompted a boycott by Western politicians, top world bankers and company e…",2018-10-23 10:47:42,"{'id': 'reuters', 'name': 'Reuters'}",Saudi sees deals worth $50 billion at investment conference despite boycotts,https://www.reuters.com/article/us-saudi-investment/saudi-sees-deals-worth-50-billion-at-investment-conference-despite-boycotts-idUSKCN1MW2TW,https://s4.reutersmedia.net/resources/r/?m=02&d=20181023&t=2&i=1317736639&w=1200&r=LYNXNPEE9M0PZ,5
159,,"Tuesday 11:00 BST Whats happening AMS of Austria led the Stoxx 600 fallers after the chipmaker warned that fourth-quarter profitability would be significantly weaker than market expectations. The company, which supplies 3D depth sensors used in Apples iPhone,… [+4163 chars]","Look to Italy for the next wave of luxury goods takeovers, says Berenberg",2018-10-23 10:53:54,"{'id': 'financial-times', 'name': 'Financial Times'}","Stocks to watch: AMS, HSBC, Moncler, Prada, CYBG",https://www.ft.com/content/2b1d1bd0-d6a1-11e8-a854-33d6f82e62f8,https://www.ft.com/__origami/service/image/v2/images/raw/http%3A%2F%2Fprod-upp-image-read.ft.com%2F3f863218-d6b1-11e8-aa22-36538487e3d0?source=next-opengraph&fit=scale-down&width=900,1
160,user6,"Indias twin surplus problem Mains Paper: 3 | Economy Prelims level: surplus problem Mains level: Twin deficit problem in the macroeconomics space Context Indias productivity challenge is, in part, due to its inability to produce on scale. It is due not just t… [+3178 chars]",India’s twin surplus problem Mains Paper: 3 | Economy Prelims level: surplus problem Mains level: Twin deficit problem in the macroeconomics space,2018-10-23 12:28:39,"{'id': None, 'name': 'Iasexamportal.com'}",THE GIST of Editorial for UPSC Exams : 23 October 2018 (India’s twin surplus problem),https://iasexamportal.com/editorial-gist/23-10-2018-reviewing-the-competition-act?utm_source=feedburner&utm_medium=feed&utm_campaign=Feed%3A+upscportal+%28IAS+EXAM+PORTAL++-+India%27s+Largest+UPSC%2C+IAS+Aspirants+Community.%29,,1
161,James Picerno,"The government's initial estimate of third-quarter GDP for the US is on track to decelerate to a 3.3% increase in the release due at the end of this week, based on the median for a set of nowcasts compiled by The Capital Spectator. That's a solid gain, but th… [+2340 chars]","The government's initial estimate of third-quarter GDP for the US is on track to decelerate to a 3.3% increase in the release due at the end of this week, based",2018-10-23 12:37:20,"{'id': None, 'name': 'Seekingalpha.com'}",U.S. Economic Growth Expected To Cool In Friday's Q3 GDP Report,https://seekingalpha.com/article/4213371-u-s-economic-growth-expected-cool-fridays-q3-gdp-report,https://static2.seekingalpha.com/uploads/2018/10/23/saupload_gdp.cs_.2018-10-23.png,1
163,Al Jazeera,"Saudi Crown Prince Mohammed bin Salman (MBS) has briefly attended a high-profile economic forum in Riyadh that was boycotted by global business chiefs and politicians after the killing of journalist Jamal Khashoggi. Many in the audience of over 2,000 clapped … [+2028 chars]",MBS says he is satisfied with Riyadh conference despite boycott by politicians and businesses over Khashoggi killing.,2018-10-23 14:52:52,"{'id': 'al-jazeera-english', 'name': 'Al Jazeera English'}",Saudi crown prince makes brief appearance at investment forum,https://www.aljazeera.com/news/2018/10/saudi-crown-prince-appearance-investment-forum-181023142413177.html,https://www.aljazeera.com/mritems/Images/2018/10/23/482a79ad68b04a3fb584e97a1afd690a_18.jpg,1
164,Kim Mackrael,The Bank of Canada is widely expected on Wednesday to raise its benchmark overnight interest rate by a quarter of a percentage point in response to solid economic growth and a new trade pact with the U.S. and Mexico. Economists from 10 out of 11 primary deale… [+2876 chars],The Bank of Canada is widely expected on Wednesday to raise its benchmark overnight interest rate by a quarter of a percentage point in response to solid economic growth and a new trade pact with the U.S. and Mexico.,2018-10-23 15:04:56,"{'id': 'the-wall-street-journal', 'name': 'The Wall Street Journal'}",Bank of Canada Widely Expected to Raise Interest Rates,https://www.wsj.com/articles/bank-of-canada-widely-expected-to-raise-interest-rates-1540307094,https://images.wsj.net/im-23545/social,1
167,Claire Heffron,"World leaders, investors, and some CEOs have pulled out of a three-day financial conference in Riyadh after the murder of journalist Jamal Khashoggi in Saudi Arabia's embassy in Istanbul. The UK trade secretary, Liam Fox, and US Treasury secretary, Steven Mnu… [+3565 chars]",Jamal Khashoggi's death has caused some world leaders and top bosses in business to pull out of Saudi Arabia's investment conference.,2018-10-23 17:01:41,"{'id': None, 'name': 'Euronews.com'}",Saudi investment forum: Who's attending and who isn't,https://www.euronews.com/2018/10/23/saudi-investment-forum-who-s-attending-and-who-isn-t,https://static.euronews.com/articles/stories/03/39/51/36/1000x563_cmsv2_cc11cdc2-eccf-5eb8-9cbc-da8190b23cf2-3395136.jpg,1
168,,"Weak earnings, macro worries and risk aversion sent the FTSE 100 to its lowest close since March, with HSBC among the sharpest fallers. HSBC s cash cow Hong Kong operations have been facing cyclical and structural pressures including a loss of market share am… [+822 chars]",HSBC among the sharpest fallers as main index has its lowest close since March,2018-10-23 17:06:19,"{'id': 'financial-times', 'name': 'Financial Times'}",Weak earnings and risk aversion hit FTSE 100,https://www.ft.com/content/41b7b758-d6e5-11e8-ab8e-6be0dcf18713,https://www.ft.com/__origami/service/image/v2/images/raw/https%3A%2F%2Fwww.ft.com%2F__assets%2Fcreatives%2Fopen-graph%2Fft-v1.jpg?source=next-opengraph&fit=scale-down&width=900,2
170,Christopher Powers,"The PGA Tour finishes off its Asian swing this week with the first World Golf Championship of the 2018-'19 season, the WGC-HSBC Champions, held at Sheshan International Golf Club in Shanghai, China. A field of 78 of the world's best players will compete for t… [+2758 chars]","Tee times and viewer's guide for the 2018 WGC-HSBC Champions at Sheshan International Golf Club in Shanghai, China.",2018-10-23 18:17:45,"{'id': None, 'name': 'Golfdigest.com'}","2018 WGC-HSBC Champions tee times, viewer's guide",https://www.golfdigest.com/story/2018-wgc-hsbc-champions-tee-times-viewers-guide,https://media.golfdigest.com/photos/5bcf602498f9027c6e054555/master/pass/GettyImages-867678348.jpg,1
172,Kyle Porter,"The last tournament of 2018 with elite-level talent takes place this week in Shanghai as we get Dustin Johnson, Rory McIlroy, Brooks Koepka and Justin Rose at the WGC-HSBC Champions. There will be loads of cash handed out, some super awkward pre-tournament ph… [+3817 chars]",You know a tournament is good if five of the top-nine golfers are in the field,2018-10-23 19:41:16,"{'id': None, 'name': 'Cbssports.com'}","2018 WGC-HSBC Champions picks, predictions odds: Ranking the field at Sheshan Golf Club",https://www.cbssports.com/golf/news/2018-wgc-hsbc-champions-picks-predictions-odds-ranking-the-field-at-sheshan-golf-club/,https://sportshub.cbsistatic.com/i/r/2018/10/22/fd549985-d292-49c5-8f4f-3934d0d7fb59/thumbnail/770x433/ba6d13ff4fcbd8e1ec0404d6a8d8bf08/tommy-f-10-22-18.png,1
174,AP,Paul Azinger used to say for years that the only thing that made a player choke was cash or prestige. So he’s not afraid to use the word “choke.” Just don’t expect to hear it when he takes over for Johnny Miller on NBC Sports next year. Azinger has pledged to… [+6043 chars],"Golf Notes: Paul Azinger's choice of vocabulary, the year's top juniors and Americans go for World Golf Championships sweep in Shanghai",2018-10-23 20:59:08,"{'id': 'fox-sports', 'name': 'Fox Sports'}",Azinger does not plan on using 'choke' in replacing Miller,https://www.foxsports.com/golf/story/azinger-does-not-plan-on-using-choke-in-replacing-miller-102318,https://b.fssta.com/uploads/2018/10/e54c1d6d765b416cb16f62019a2ef2dc.vresize.1200.630.high.52.jpg,2
175,Bangkok Post Public Company Limited,Shanghai: Kiradech Aphibarnrat aims to get another good result in the World Golf Championships at this week's WGC-HSBC Champions. The US$10 million tournament at the Sheshan International Golf Club begins tomorrow. It will be Kiradech's second tournament as a… [+2563 chars],Shanghai: Kiradech Aphibarnrat aims to get another good result in the World Golf Championships at this week's WGC-HSBC Champions.,2018-10-23 21:00:00,"{'id': None, 'name': 'Bangkokpost.com'}",Kiradech to bring out 'A' game,https://www.bangkokpost.com/news/sports/1563346/kiradech-to-bring-out-a-game,https://www.bangkokpost.com/media/content/dcx/2018/10/24/2965714_620x413.jpg,1
177,,Perhaps the idea of traveling across the globe right now was simply not very appealing. Or the period of rest and recovery from a long season of golf was not complete. Maybe he's not a big fan of the Sheshan International course. There are myriad reasons why … [+8836 chars],Tiger suggested this week he is ready to turn his attention to where and when he will play this coming season. We decided to help him out.,2018-10-23 21:23:39,"{'id': None, 'name': 'Espn.com'}",What Tiger Woods' schedule could (and should) look like,http://www.espn.com/golf/story/_/id/25064109/what-tiger-woods-schedule-look-2018-2019-golf-season,http://a4.espncdn.com/combiner/i?img=%2Fphoto%2F2018%2F1024%2Fr451941_1296x729_16%2D9.jpg,1
178,https://www.dailymail.co.uk/home/search.html?s=&authornamef=Amelia+Murray+For+The+Daily+Mail,"Thousands of TSB customers have fled the bank following its IT disaster back in April. Some 16,641 TSB current account holders switched to a rival between April and June - the largest exodus from any High Street bank. Experts expected the figure to be even hi… [+721 chars]","Some 16,641 TSB current account holders switched to a rival between April and June - the largest exodus from any High Street bank.",2018-10-23 22:18:40,"{'id': None, 'name': 'Thisismoney.co.uk'}","TSB's IT fiasco sparks more than 16,000 customers to flee to rival banks",https://www.thisismoney.co.uk/money/news/article-6308607/TSBs-fiasco-sparks-16-000-customers-flee-rival-banks.html,https://i.dailymail.co.uk/1s/2018/10/23/23/5341246-0-image-a-2_1540332948318.jpg,1
179,https://www.facebook.com/bbcnews,"Image copyright Reuters Image caption Paul Pester was forced to resign as boss of TSB More than 16,000 customers have deserted the TSB in the wake of an IT meltdown earlier this year. The figures - released by the payments operator BACS - show the net loss in… [+1226 chars]",More customers deserted the TSB than ever before in the wake of its IT meltdown.,2018-10-23 23:04:31,"{'id': 'bbc-news', 'name': 'BBC News'}","TSB loses 16,000 customers after IT chaos",https://www.bbc.co.uk/news/business-45952283,https://ichef.bbci.co.uk/news/1024/branded_news/18631/production/_103998899_hi049044617.jpg,1
180,CBS Sports Staff,"Before you set your PGA Tour DFS lineups on sites like DraftKings and FanDuel for the 2018 WGC-HSBC Champions, you need to hear what Mike McClure has to say. McClure is a DFS pro with almost $2 million in career winnings, and he has been red-hot on his PGA To… [+1937 chars]","SportsLine's Mike McClure, a DFS pro with more than $1 million in winnings, gives optimal lineup advice",2018-10-23 23:55:23,"{'id': None, 'name': 'Cbssports.com'}","PGA Tour DFS, WGC-HSBC Champions 2018: Best DraftKings, FanDuel daily fantasy golf picks",https://www.cbssports.com/golf/news/pga-tour-dfs-wgc-hsbc-champions-2018-best-draftkings-fanduel-daily-fantasy-golf-picks/,https://sportshub.cbsistatic.com/i/r/2018/07/29/61e6b45d-b6d3-41dd-9a3d-3bc647588819/thumbnail/770x433/e4d995fc6211befb8f31248769bf3c81/usatsi-10993127-dustin-johnson-1st-tee.jpg,1
181,"Associated Press, By Associated Press","SHANGHAI — Brooks Koepka is having the kind of year he only imagined in his dreams, and he's not ready for it to end. In June, he became the first player in 29 years to win back-to-back in the U.S. Open. In August, he played some his best golf amid ear-splitt… [+3900 chars]","SHANGHAI — Brooks Koepka is having the kind of year he only imagined in his dreams, and he&#39;s not ready for it to end.In June, he became the first player in 29 years to win back-to-back in the U.S. Open. In August, he played some his best golf amid ear-spl…",2018-10-24 00:00:00,"{'id': None, 'name': 'Bostonherald.com'}",Brooks Koepka makes debut at No. 1 and hopes to keep rolling,http://www.bostonherald.com/sports/golf/2018/10/brooks_koepka_makes_debut_at_no_1_and_hopes_to_keep_rolling,http://www.bostonherald.com/sites/default/files/styles/full/public/media/ap/2018/10/24/5167011836b44d15b1403f73ce653e57.jpg?itok=eEPZEWmx,3
182,Sky News,"Almost 22,000 customers ditched TSB in the wake of the chaos inflicted on them by the bank's bungled IT migration, according to industry figures. Statistics released by bank body Bacs, which operates the seven-day current account switch service (Cass), showed… [+1854 chars]","Almost 22,000 customers ditched TSB in the wake of the chaos inflicted on them by the bank's bungled IT migration, according to industry figures.",2018-10-24 04:47:00,"{'id': None, 'name': 'Sky.com'}","20,000 customers ditch TSB after IT chaos",https://news.sky.com/story/over-20000-customers-ditch-tsb-after-it-migration-chaos-11534055,https://e3.365dm.com/18/04/1600x900/skynews-tsb-bank_4292855.jpg?20180426094808,1
183,Reuters Editorial,"DUBAI, Oct 24 (Reuters) - The government of Oman has begun marketing a seven-year U.S. dollar-denominated sukuk, or Islamic bond, according to IFR, a fixed-income news service. The paper is being marketed with initial price guidance of about 300 basis points … [+324 chars]","The government of Oman has begun marketing a seven-year U.S. dollar-denominated sukuk, or Islamic bond, according to IFR, a fixed-income news service.",2018-10-24 06:29:48,"{'id': 'reuters', 'name': 'Reuters'}",Oman starts marketing dollar sukuk -IFR,https://www.reuters.com/article/oman-sukuk/oman-starts-marketing-dollar-sukuk-ifr-idUSL8N1X41H9,https://s4.reutersmedia.net/resources_v2/images/rcom-default.png,2
184,,"TVS Motor has come out with its September quarter numbers on October 23, 2018. It has reported a fall of 0.9 percent (year-on-year) in its net profit for the September quarter at Rs 211.31 crore. The company had reported a profit of Rs 216.16 crore during the… [+1902 chars]","The company has declared an interim dividend, for the financial year ending March 31, 2019, at the rate of Rs 2.10 per share (210 percent).",2018-10-24 06:43:17,"{'id': None, 'name': 'Moneycontrol.com'}","TVS Motor Q2 net profit at Rs 211cr; Credit Suisse, Jefferies cut target upto Rs 420",https://www.moneycontrol.com/news/business/markets/tvs-motor-q2-net-profit-at-rs-211cr-credit-suisse-jefferies-cut-target-upto-rs-420-3079411.html,https://static-news.moneycontrol.com/static-mcnews/2018/03/TVS-Apache-RTR-200-770x435.jpg,1
185,"AP, AP","Brooks Koepka of the United States reacts after his shot on the 16th hole during the final round of the CJ Cup PGA golf tournament at Nine Bridges on Jeju Island, South Korea, Sunday, Oct. 21, 2018. (Park Ji-ho/Yonhap via AP) (Photo: The Associated Press) SHA… [+4292 chars]",Brooks Koepka at No. 1 in the world and looking for a strong finishing kick to a dream year,2018-10-24 07:07:57,"{'id': 'usa-today', 'name': 'USA Today'}",Koepka makes debut at No. 1 and hopes to keep rolling,https://www.usatoday.com/story/sports/golf/2018/10/24/koepka-makes-debut-at-no-1-and-hopes-to-keep-rolling/38257353/?utm_source=google&utm_medium=amp&utm_campaign=speakable,https://www.gannett-cdn.com/-mm-/cd40a7eb3b47aa8fc67ecfb3b781879dc74a2033/c=0-777-1571-1661/local/-/media/2018/10/24/USATODAY/usatsports/c383b92a982e4aa5ad051136dbf0ada9.jpg?width=3200&height=1680&fit=crop,1
188,Sumeet Chatterjee,"HONG KONG/SHANGHAI (Reuters) - News of a foreign wealth manager being denied exit from China last week is raising concerns for global private banks, as they seek to tap trillions of dollars of wealth offshore in the face of Beijing’s growing curbs on overseas… [+4785 chars]","News of a foreign wealth manager being denied exit from China last week is raising concerns for global private banks, as they seek to tap trillions of dollars of wealth offshore in the face of Beijing's growing curbs on overseas investments and outflows.",2018-10-24 08:20:20,"{'id': 'reuters', 'name': 'Reuters'}",A banker's woe: Chinese wealth may get harder to snag for global bankers,https://www.reuters.com/article/us-china-wealth-analysis/a-bankers-woe-chinese-wealth-may-get-harder-to-snag-for-global-bankers-idUSKCN1MY0TG,https://s1.reutersmedia.net/resources/r/?m=02&d=20181024&t=2&i=1318077108&w=1200&r=LYNXNPEE9N0LA,1
