,author,content,description,publishedAt,source,title,url,urlToImage,count
708,Ben Canner,"Yesterday HSBC Bank publically disclosed what appears, on the surface, a relatively minor data breach. Based in the U.K., HSBC Bank announced unauthorized users gained access to a host of financial and personal information. In an official statement to custome… [+3541 chars]","Yesterday HSBC Bank publically disclosed what appears, on the surface, a relatively minor data breach. Based in the U.K., HSBC Bank announced unauthorized users gained access to a host of financial and personal information. In an official statement to custome…",2018-11-07 17:17:00,"{'id': None, 'name': 'Solutionsreview.com'}",How Credential Stuffing Led to the HSBC Data Breach,https://solutionsreview.com/identity-management/credential-stuffing-led-hsbc-data-breach/,https://solutionsreview.com/identity-management/files/2018/04/password-behaviors-mod.jpg,1
711,Alessandra Malito,"Happy Wednesday, MarketWatchers! Here are the top personal finance stories of the day. Personal Finance I have wedding guest fatigue can single people spend half as much on a gift? A recent divorcée says she doesnt want to spend as much as married couples. Bo… [+3782 chars]",Wednesday's top personal finance stories,2018-11-07 20:10:01,"{'id': None, 'name': 'Marketwatch.com'}",Personal Finance Daily: The midterm elections made history this year and how election results affect student-loan borrowers,https://www.marketwatch.com/story/the-midterm-elections-made-history-this-year-and-how-election-results-affect-student-loan-borrowers-2018-11-07,https://mw3.wsj.net/mw5/content/logos/mw_logo_social.png,1
713,,"News is breaking that banking giant HSBC disclosed a security incident exposing an undisclosed number of customers data. This is just the latest security incident reported by HSBC, which experienced DDoS attacks in January 2016 and July 2016, in addition to l… [+7420 chars]","News is breaking that banking giant HSBC disclosed a security incident exposing an undisclosed number of customers’ data. This is just the latest security incident reported by HSBC, which experienced DDoS attacks in January 2016 and July 2016, in addition to …",2018-11-07 20:52:00,"{'id': None, 'name': 'Informationsecuritybuzz.com'}",HSBC Security Incident – Customer Details Exposed,https://www.informationsecuritybuzz.com/expert-comments/hsbc-security-incident/,https://www.informationsecuritybuzz.com/wp-content/uploads/incident-management-2.jpg,1
714,Reuters Editorial,"Nov 7 (Reuters) - The following financial services industry appointments were announced on Wednesday. To inform us of other job changes, email moves@thomsonreuters.com. UBS UBS has poached Wendy Liu from Nomura for the newly created role of head of China stra… [+595 chars]","The following financial services industry appointments were announced on Wednesday. To inform us of other job changes, email moves@thomsonreuters.com.",2018-11-07 21:10:31,"{'id': 'reuters', 'name': 'Reuters'}","MOVES- UBS, J.P. Morgan Private Bank, HSBC",https://www.reuters.com/article/financial-moves-idUSL4N1XI61J,https://s4.reutersmedia.net/resources_v2/images/rcom-default.png,1
715,Susan Edmunds and Rob Stock,Banks have been big news over recent weeks. Westpac and ANZ published record profits - ANZ nudging the $2 billion mark for the first time. BNZ reported a 10 per cent earnings jump. Then the Financial Markets Authority and Reserve Bank published their report i… [+5072 chars],"Big or small, Australian-owned or local, they all offer subtly different things.",2018-11-07 23:05:24,"{'id': None, 'name': 'Stuff.co.nz'}",Which bank offers the best value for customers?,https://www.stuff.co.nz/business/108445741/Which-bank-offers-the-best-value-for-customers,https://resources.stuff.co.nz/content/dam/images/1/s/k/g/f/j/image.related.StuffLandscapeSixteenByNine.1420x800.1skd9p.png/1541631924635.jpg,1
717,Uzair Amir,"The Hongkong and Shanghai Banking Corporation (HSBC) has suffered a data breach in which unknown hackers have accessed personal and financial data of its customers. The data breach, according to the notification from HSBC, took between October 4, 2018, and Oc… [+2679 chars]","By Uzair Amir The Hongkong and Shanghai Banking Corporation (HSBC) has suffered a data breach in which unknown hackers have accessed personal and financial data of its customers. The data breach, according to the notification from HSBC, took between October 4…",2018-11-08 00:02:37,"{'id': None, 'name': 'Hackread.com'}",HSBC suffers data breach after hackers access customers’ personal data,https://www.hackread.com/hsbc-data-breach-hackers-access-customers-data/,https://www.hackread.com/wp-content/uploads/2018/11/hsbc-suffers-data-breach-after-hackers-access-customers-personal-data.jpg,1
718,Jessica Kerr,"Musqueam artist Chrystal Sparrow in 2016 at the unveiling of her Salish Sea Waters panel that hangs in Vancouver city hall. Vancouver Park Board Wednesday announced Sparrow as the inaugural artist chosen for the A-Frame Activation: Musqueam, Squamish and Tsle… [+2104 chars]",Vancouver Park Board Wednesday announced the first Indigenous artist chosen for a new residency at Second Beach. Musqueam artist Chrystal Sparrow is the inaugural artist selected for the A-Frame Activation. The post Vancouver Park Board announces first artist…,2018-11-08 00:19:50,"{'id': None, 'name': 'Vancouverisawesome.com'}",Vancouver Park Board announces first artist in Indigenous cultural residency,https://www.vancouverisawesome.com/2018/11/07/vancouver-first-indigenous-artist/,https://assets.vancouverisawesome.com/wp-content/uploads/2018/11/07161134/chrystal-sparrow.jpg,1
719,Reuters,"By Jonathan Stempel NEW YORK (Reuters) - A group of large institutional investors including BlackRock Inc and Allianz SE's Pacific Investment Management Co has sued 16 major banks, accusing them of rigging prices in the roughly $5.1 trillion-a-day foreign exc… [+2412 chars]","By Jonathan Stempel NEW YORK (Reuters) - A group of large institutional investors including BlackRock Inc and Allianz SE's Pacific Investment Management Co has sued 16 major banks, accusing them of rigging prices in the roughly $5.1 trillion-a-day foreign exc…",2018-11-08 00:35:09,"{'id': None, 'name': 'Firstpost.com'}",Big investors sue 16 banks in U.S. over currency market rigging,https://www.firstpost.com/business/big-investors-sue-16-banks-in-u-s-over-currency-market-rigging-5516771.html,https://images.firstpost.com/wp-content/uploads/reuters/11-2018/08/2018-11-07T233234Z_1_LYNXNPEEA624E_RTROPTP_2_ALLIANZ-RESULTS.jpg,2
721,Telis Demos,"Wall Street analysts are doing data differently. Banks for years have crunched data on company earnings, price targets and other mundane metrics for clients who might use the information to make investing and trading decisions. Now they are pulling data from … [+5281 chars]","Bank research units are finding new ways to crunch data for clients including deeper looks into social-media sentiment, geospatial mapping and other unorthodox sources.",2018-11-08 03:42:59,"{'id': 'the-wall-street-journal', 'name': 'The Wall Street Journal'}","Wall Street Analysts Are Now Selling More Data, Less Analysis",https://www.wsj.com/articles/driving-to-the-mall-and-googling-luke-cage-banks-try-to-keep-clients-attention-with-data-1541586600,https://images.wsj.net/im-35023/social,1
722,Bloomberg,"Streamcast Group, a firm whose technology enables streaming services and boosts networks in emerging markets, is considering an initial public offering (IPO) as soon as next year, people familiar with the matter said. The company is aiming to list in London, … [+1179 chars]","Discussions about an IPO are at an early stage and Streamcast, which does much of its business in Malta, India and developing nations, may still decide against selling shares.",2018-11-08 04:10:31,"{'id': None, 'name': 'Livemint.com'}",Streamcast is said to weigh London IPO,https://www.livemint.com/Companies/KWw8Usi3UPY2JO3MBOHr3H/Streamcast-is-said-to-weigh-London-IPO.html,https://www.livemint.com/rf/Image-621x414/LiveMint/Period2/2018/11/09/Photos/Processed/ipo-k0jE--621x414@LiveMint.jpg,2
724,Dhwani Mehta,Note: All information on this page is subject to change. The use of this website constitutes acceptance of our user agreement. Please read our privacy policy and legal disclaimer. Trading foreign exchange on margin carries a high level of risk and may not be … [+1276 chars],"Analysts at HSBC offer a brief preview of Friday’s Reserve Bank of Australia’s (RBA) Statement of Monetary Policy (SoMP) due at 0030 GMT. Key Quotes: “We doubt that the RBA will revise up its growth forecasts, and expect them to be the same as the last set - …",2018-11-08 04:39:06,"{'id': None, 'name': 'Fxstreet.com'}",RBA SoMP: Expect no revisions to growth forecasts - HSBC,https://www.fxstreet.com/news/rba-somp-expect-no-revisions-to-growth-forecasts-hsbc-201811080439,https://editorial.azureedge.net/images/Macroeconomics/CentralBanks/RBA/reserve-bank-of-australia-30178850_Large.jpg,1
725,,"When Texas-based Tricon Energy wanted to buy polymers from Indias Reliance Energy, the two companies avoided the usual rigmarole of phone calls, couriered documents and emails by logging on to a new blockchain system called Voltron. Within minutes they had co… [+5539 chars]",Blockchain promises big returns for $16tn industry but revenues remain elusive,2018-11-08 05:00:36,"{'id': 'financial-times', 'name': 'Financial Times'}",Banks race to make money on trade finance platforms,https://www.ft.com/content/85324256-d824-11e8-a854-33d6f82e62f8,https://www.ft.com/__origami/service/image/v2/images/raw/http%3A%2F%2Fprod-upp-image-read.ft.com%2Ffde22f48-e28f-11e8-8e70-5e22a430c1ad?source=next-opengraph&fit=scale-down&width=900,1
726,Dhwani Mehta,"Forex today in Asia was characterized by minimal volatility and tight trading ranges, as the dust settled over the US mid-term elections aftermath. The US dollar staged a solid comeback across its major rivals, having almost reversed a Democrats win induced s… [+2986 chars]","Forex today in Asia was characterized by minimal volatility and tight trading ranges, as the dust settled over the US mid-term elections aftermath. The US dollar staged a solid comeback across its major rivals, having almost reversed a Democrats win induced s…",2018-11-08 06:15:17,"{'id': None, 'name': 'Fxstreet.com'}",Forex Today: US dollar extends post-US election recovery ahead of FOMC decision,https://www.fxstreet.com/news/forex-today-us-dollar-extends-post-us-election-recovery-ahead-of-fomc-decision-201811080615,https://editorial.azureedge.net/images/Markets/Currencies/Majors/DollarIndex/coin-of-the-united-states-dollar-gm486202853-38323302_Large.jpg,1
727,Troy Hunt,It's just another day on the internet when the news is full of headlines about accounts being hacked. Yesterday was a perfect example of that with 2 separate noteworthy stories adorning my early morning Twitter feed. The first one was about HSBC disclosing a … [+11372 chars],It's just another day on the internet when the news is full of headlines about accounts being hacked. Yesterday was a perfect example of that with 2 separate noteworthy stories adorning my early morning Twitter feed. The first one was about HSBC disclosing a …,2018-11-08 06:37:14,"{'id': None, 'name': 'Troyhunt.com'}","When Accounts are ""Hacked"" Due to Poor Passwords, Victims Must Share the Blame",https://www.troyhunt.com/when-accounts-are-hacked-victims-must-share-the-blame/,https://www.troyhunt.com/content/images/2018/11/MySafeP@ssw0rd-.jpg,1
728,Security Newspaper,"The HSBC headquarters in Istanbul are pictured on June 9, 2015. Scandal-hit bank HSBC said on June 9 it would cut its global headcount by up to 50,000 as part of a restructuring that entails its withdrawal from Brazil and Turkey, while it also mulls abandonin… [+2382 chars]","The HSBC headquarters in Istanbul are pictured on June 9, 2015. Scandal-hit bank HSBC said on June 9 it would cut its global headcount by up to 50,000 as part of a restructuring that entails its withdrawal from Brazil and Turkey, while it also mulls abandonin…",2018-11-08 07:05:00,"{'id': None, 'name': 'Securitynewspaper.com'}",HSBC confirms data theft in the United States,http://www.securitynewspaper.com/2018/11/08/hsbc-confirms-data-theft-in-the-united-states/,http://www.securitynewspaper.com/snews-up/2018/11/hsbc.jpg,1
729,,"With an average annual income of $90,408, nine out of 10 expats said in Vietnam they are as happy as or happier than at home, according to the 11th annual Expat Explorer issued by HSBC on Wednesday. Foreigners enjoy working in Vietnam for many benefits: 55 pe… [+2540 chars]","Vietnam has climbed four places to 19th in the list of best countries for expats to work and live, an HSBC survey found.",2018-11-08 08:13:01,"{'id': None, 'name': 'Vnexpress.net'}",Vietnam 19th best country in the world for expats: HSBC survey,https://e.vnexpress.net/news/business/data-speaks/vietnam-19th-best-country-in-the-world-for-expats-hsbc-survey-3836012.html,https://vcdn-english.vnecdn.net/2018/11/08/shutterstock1170572908-1541641-1605-1838-1541641974_680x0.png,1
730,SA Editor Yoel Minkoff,The U.S. Justice Department is almost done with its actions against financial institutions over their role in the sale and pooling of mortgage securities which helped cause the financial crisis. UBS said it expects to be sued on civil charges as early as toda… [+273 chars],The U.S. Justice Department is almost done with its actions against financial institutions over their role in the sale and pooling of mortgage securities which helped cause the financial crisis.UBS sa,2018-11-08 08:21:50,"{'id': None, 'name': 'Seekingalpha.com'}",UBS to fight DOJ over crisis-era mortgages,https://seekingalpha.com/news/3407103-ubs-fight-doj-crisis-era-mortgages,https://static3.seekingalpha.com/assets/og_image_192-59bfd51c9fe6af025b2f9f96c807e46f8e2f06c5ae787b15bf1423e6c676d4db.png,1
731,newsfeedback@fool.com (Motley Fool Transcribers),"Image source: The Motley Fool. Ctrip.com International, Ltd. ( NASDAQ:CTRP ) Q3 2018 Earnings Conference Call Nov. 07, 2018, 7:00 p.m. ET Contents: Prepared Remarks Questions and Answers Call Participants Prepared Remarks: Operator Ladies and gentlemen, welco… [+44449 chars]","CTRP earnings call for the period ending September 30, 2018.",2018-11-08 08:56:12,"{'id': None, 'name': 'Fool.com'}","Ctrip.com International, Ltd. (CTRP) Q3 2018 Earnings Conference Call Transcript",https://www.fool.com/earnings/call-transcripts/2018/11/08/ctripcom-international-ltd-ctrp-q3-2018-earnings-c.aspx,https://g.foolcdn.com/image/?url=https%3A%2F%2Fg.foolcdn.com%2Feditorial%2Fimages%2F501024%2Ffeatured-transcript-logo.png&h=630&w=1200&op=resize,1
732,Will Martin,"Uncertainties surrounding Brexit has for the most part slowed the amount of money flowing into the UK —companies are putting projects on hold, staff are being relocated from London to other European business hubs, and London's role as a dominant financial cen… [+1590 chars]","FirethornTrust, a property investment firm run by two US billionaire families, is looking to invest heavily in London property. The firm, run in tandem by two families, the Stephens and the Van Tuyls, is bucking the trend of delayed investments post-Brexit. ""…",2018-11-08 09:48:37,"{'id': 'business-insider', 'name': 'Business Insider'}",Two American billionaire families are using Brexit to build a London property empire,https://www.businessinsider.com/billionaire-us-families-look-to-brexit-to-build-london-property-empire-2018-11,https://amp.businessinsider.com/images/5b7d2098e361c074048b4e63-1920-960.jpg,1
733,"Sarah Hansen, Contributor, Sarah Hansen, Contributor https://www.forbes.com/sites/sarahhansen/","Getty Creative Getty Kaleido, a startup that aims to help enterprises implement blockchain technology, has launched a new platform in collaboration with Amazon Web Services (AWS). Kaleido Marketplace will provide tools and protocols for all the components of … [+8542 chars]","Kaleido, a startup aimed at helping enterprises implement blockchain technology, has launched a new platform in collaboration with Amazon Web Services (AWS).",2018-11-08 11:02:48,"{'id': None, 'name': 'Forbes.com'}",ConsenSys’ Kaleido Launches Full-Stack Marketplace Platform for Enterprise Blockchains,https://www.forbes.com/sites/sarahhansen/2018/11/08/consensys-kaleido-launches-full-stack-marketplace-platform-for-enterprise-blockchains/,https://thumbor.forbes.com/thumbor/600x315/https%3A%2F%2Fspecials-images.forbesimg.com%2Fimageserve%2F935705246%2F960x0.jpg,1
734,,Minsey WengShriners Hospitals for Children OpenJordan SpiethTPC at Summerlin El Camaleon Golf ClubOHL Classic at Mayakoba Tour Championship 2018Annie Verret Rickie FowlerTony Finau Patton KizzireHero World Challenge 2016Puerto Rico Open at Coco BeachWGC - HSB… [+10 chars],【羅開新聞中心Minsey Weng綜合報導】上週在Shriners Hospitals for Children Open（拉斯維加斯公開賽）的新球季初登場 ...,2018-11-08 12:14:10,"{'id': None, 'name': 'Yahoo.com'}",高爾夫》史畢斯南下墨西哥，馬亞柯巴之戰告別單身漢,https://tw.sports.yahoo.com/news/%E9%AB%98%E7%88%BE%E5%A4%AB-%E5%8F%B2%E7%95%A2%E6%96%AF%E5%8D%97%E4%B8%8B%E5%A2%A8%E8%A5%BF%E5%93%A5-%E9%A6%AC%E4%BA%9E%E6%9F%AF%E5%B7%B4%E4%B9%8B%E6%88%B0%E5%91%8A%E5%88%A5%E5%96%AE%E8%BA%AB%E6%BC%A2-121410698--golf.html,,1
738,David Scutt,"Japanese government debt stands at more than 200% of GDP, significantly higher than the level seen in other advanced economies. Bond buying from the Bank of Japan has helped to depress Japanese government bond yields, keeping interest payments for the governm… [+2308 chars]","Japanese government debt stands at more than 200% of GDP, significantly higher than the level seen in other advanced economies. Bond buying from the Bank of Japan has helped to depress Japanese government bond yields, keeping interest payments for the governm…",2018-11-08 13:41:49,"{'id': None, 'name': 'Businessinsider.com.au'}","When it comes to government debt levels, one nation stands out among the rest",https://www.businessinsider.com.au/japan-government-debt-boj-qqe-2018-11,https://edge.alluremedia.com.au/uploads/businessinsider/2016/03/Japan-liquidity-640x360.jpg,1
739,Jon Shazar,"Fort Knox it ain’t. Getty Images Are you American? Bank with HSBC? You might want to be a little less than 1% worried right now, because thats how many of you are unwittingly and unwillingly sharing some pretty important info with hackers. The lender said tha… [+681 chars]","‘Cause someone else has’em now, too.",2018-11-08 14:44:51,"{'id': None, 'name': 'Dealbreaker.com'}","HSBC Hopes You Weren’t Using Your Name, Address, Birthday, Account Numbers…",https://dealbreaker.com/2018/11/hsbc-hopes-you-werent-using-your-name-address-birthday-account-numbers/,https://dealbreaker.com/uploads/2016/10/GettyImages-3029697-300x180.jpg,1
740,,"HSBC Bank USA notified customers of a data breach that has happened between Oct 4 and Oct 14, unknown attackers were able to access their online accounts. HSBC Bank USA notified customers of a data breach that has happened between October 4 and October 14, un… [+2550 chars]","#1236012: HSBC Bank USA notified customers of a security breach. HSBC Bank USA notified customers of a data breach that has happened between Oct 4 and Oct 14, unknown attackers were able to access their online accounts. HSBC Bank USA notified customers of a d…",2018-11-08 15:04:00,"{'id': None, 'name': 'Brica.de'}",HSBC Bank USA notified customers of a security breach,https://brica.de/alerts/alert/public/1236012/hsbc-bank-usa-notified-customers-of-a-security-breach/,,1
741,Neil Ford,"This week, we discuss a data breach affecting HSBC’s US customers, a XSS vulnerability in Evernote and a critical RCE vulnerability in Apache Struts Hello and welcome to a the IT Governance podcast for Friday, 9 November. Here are this week’s stories. HSBCs U… [+4904 chars]","This week, we discuss a data breach affecting HSBC’s US customers, a XSS vulnerability in Evernote and a critical RCE vulnerability in Apache Struts Hello and welcome to a the IT Governance podcast for Friday, 9 November. Here are this week’s stories. HSBC’s …",2018-11-08 15:53:00,"{'id': None, 'name': 'Itgovernance.co.uk'}","Weekly podcast: HSBC, Evernote and Apache Struts",https://www.itgovernance.co.uk/blog/weekly-podcast-hsbc-evernote-and-apache-struts,https://www.itgovernance.co.uk/blog/wp-content/uploads/2018/11/Podcast-Thumb-9th-nov.png,1
742,https://www.facebook.com/tom.jowitt,"Customers of HSBC in the United States have had their personal details including account numbers and transaction history exposed in a data breach. Whilst the bank has made no official statement on the matter, the breach came to light after a template of the a… [+4762 chars]","Customers of HSBC in the United States have had their personal details including account numbers and transaction history exposed in a data breach. Whilst the bank has made no official statement on the matter, the breach came to light after a template of the a…",2018-11-08 16:03:00,"{'id': None, 'name': 'Silicon.co.uk'}",HSBC Confirms Data Breach Of US Customers,https://www.silicon.co.uk/e-marketing/epayment/hsbc-data-breach-us-238697,https://www.silicon.co.uk/wp-content/uploads/2016/01/HSBC.jpg,1
743,"Naomi Ng, Naomi Ng","A number of accounts from HSBCs e-wallet PayMe were hacked into and led to unauthorised transactions, Hong Kongs biggest bank said on Thursday. HSBC said they were notified of email accounts being compromised, which led to unauthorised access of a very small … [+980 chars]","A number of accounts from HSBC’s e-wallet PayMe were hacked into and led to “unauthorised transactions”, Hong Kong’s biggest bank said on Thursday. HSBC said they were notified of email accounts being compromised, which led to unauthorised access of a “very s…",2018-11-08 16:06:25,"{'id': None, 'name': 'Scmp.com'}","HSBC email accounts hacked, leading to ‘unauthorised transactions’, Hong Kong’s biggest bank says",https://www.scmp.com/news/hong-kong/law-and-crime/article/2172382/hsbc-email-accounts-hacked-leading-unauthorised,https://cdn3.i-scmp.com/sites/default/files/styles/620x356/public/images/methode/2018/11/09/07b0d074-e367-11e8-9876-950c8650801f_image_hires_000818.jpg?itok=z0s4Gscd,1
745,Kalyeena Makortoff,"The Swiss bank UBS has pledged to vigorously defend itself in a pending lawsuit by the US justice department, which has already clawed billions of dollars from lenders over the mis-selling of complex financial products that contributed to the 2008 financial c… [+2468 chars]","Swiss bank has already paid $230m to New York and says it was a victim of financial crisis The Swiss bank UBS has pledged to vigorously defend itself in a pending lawsuit by the US justice department, which has already clawed billions of dollars from lenders …",2018-11-08 16:39:53,"{'id': 'the-guardian-au', 'name': 'The Guardian (AU)'}",UBS will 'vigorously' defend DoJ lawsuit over financial crash,https://www.theguardian.com/business/2018/nov/08/ubs-will-vigorously-defend-doj-lawsuit-over-financial-crash,https://i.guim.co.uk/img/media/a5d894d10cd2294b4de44a3cb8905abf75b2e052/0_30_3500_2100/master/3500.jpg?width=1200&height=630&quality=85&auto=format&fit=crop&overlay-align=bottom%2Cleft&overlay-width=100p&overlay-base64=L2ltZy9zdGF0aWMvb3ZlcmxheXMvdGctZGVmYXVsdC5wbmc&s=25717c038b125c3b3128033ee9b609d3,1
746,,"Data from around 1% of HSBC Bank PLC's 1.4 million U.S.-based customers was breached last month, the bank disclosed. Hackers likely carried out the attack using credentials stolen from a different source, according to the company. What HSBC says: What was bre… [+5402 chars]","#1236041: Hack Dissection: HSBC Hit in Suspected Credential-Stuffing Attack. Data from around 1% of HSBC Bank PLC's 1.4 million U.S.-based customers was breached last month, the bank disclosed. Hackers likely carried out the attack using credentials stolen fr…",2018-11-08 16:50:00,"{'id': None, 'name': 'Brica.de'}",Hack Dissection: HSBC Hit in Suspected Credential-Stuffing Attack,https://brica.de/alerts/alert/public/1236041/hack-dissection-hsbc-hit-in-suspected-credential-stuffing-attack/,,1
747,SA Editor Liz Kiesche,"JPMorgan Chase ( JPM +1.2% ) and Carlyle Group ( CG +1.5% ) invest in iCapital Network, a fintech platform for alternative investments, as strategic partners in its latest financing round. Terms weren't disclosed. Besides the investment, Carlyle will also use… [+582 chars]","JPMorgan Chase (JPM +1.2%) and Carlyle Group (CG +1.5%) invest in iCapital Network, a fintech platform for alternative investments, as strategic partners in its latest financing round.Terms weren't di",2018-11-08 17:23:39,"{'id': None, 'name': 'Seekingalpha.com'}",Carlyle and JPMorgan invest in iCapital Network,https://seekingalpha.com/news/3407537-carlyle-jpmorgan-invest-icapital-network,https://static3.seekingalpha.com/assets/og_image_192-59bfd51c9fe6af025b2f9f96c807e46f8e2f06c5ae787b15bf1423e6c676d4db.png,1
